{
  "report_format_version": "2.2",
  "report_type": "aicp.external_evidence",
  "execution_mode": "full-profile",
  "execution_subject": {
    "kind": "external_implementation",
    "implementation_id": "test-only-product-profile-external",
    "implementation_version": "1.0.0",
    "implementation_digest": "sha256:bbbbbbbbbbbbbbbbbbbbbbbbbbbbbbbbbbbbbbbbbbbbbbbbbbbbbbbbbbbbbbbb"
  },
  "runner": {
    "name": "aicp-external-evidence-runner",
    "version": "2.2",
    "source_revision": "sha256:77498e0b1801a2fdc94ebc7947fe3f9df5395332ef272f49ce7cecb6050ceed0"
  },
  "tck_release": {
    "release_id": "AICP-EVIDENCE-TCK-1.10.0",
    "registry_digest": "sha256:7f57814d35cab7d7d50241b41ede7eb182e2b9f890928d04a6c872bb19f743dc",
    "target_registry_digest": "sha256:6aaa954733282583cd32311956af00ef6599f984af99e09f7d330c479f50924b",
    "target_registry_schema_digest": "sha256:2ce885d972041e631fc67d7a39fa8dbe54d04e123e6277ead6a4accc3b63020f",
    "target_catalog_digest": "sha256:b05ee4fdc5779e7c41710d7cee4c8912e6dbe03cd57c270027f7ddb8c6ef007c",
    "report_schema_digest": "sha256:5a2a5ce0c3b12a2c5f7224508bffc47635e20b85526ac8148721b9fe78df6e28",
    "runner_bundle_digest": "sha256:77498e0b1801a2fdc94ebc7947fe3f9df5395332ef272f49ce7cecb6050ceed0"
  },
  "target": {
    "kind": "product_profile",
    "target_id": "AICP-MEDIATED-BLOCKING",
    "target_version": "0.1",
    "target_catalog_digest": "sha256:b05ee4fdc5779e7c41710d7cee4c8912e6dbe03cd57c270027f7ddb8c6ef007c"
  },
  "required_suites": [
    {
      "suite_id": "CT-CORE-0.1",
      "suite_version": "0.1.0-dev",
      "path": "conformance/core/CT_CORE_0.1.json",
      "suite_digest": "sha256:51272d58c2f284db18a8b8b2a4c7b3bc616ae597b0e6286e39a696d1a316816a"
    },
    {
      "suite_id": "CN-CAPNEG-0.1",
      "suite_version": "0.1.0-dev",
      "path": "conformance/extensions/CN_CAPNEG_0.1.json",
      "suite_digest": "sha256:ac1bfb0832eaa9473a37d31f0fd635a11307bea4cc444de6670e917d6d159d1a"
    },
    {
      "suite_id": "PE-POLICY-EVAL-0.1",
      "suite_version": "0.1.0-dev",
      "path": "conformance/extensions/PE_POLICY_EVAL_0.1.json",
      "suite_digest": "sha256:486a86b7cb0c3f8bc6b0fecc6c20dc853fd8e0a68bd334b6319839459739b0f6"
    },
    {
      "suite_id": "ENF-ENFORCEMENT-0.1",
      "suite_version": "0.1.0-dev",
      "path": "conformance/extensions/ENF_ENFORCEMENT_0.1.json",
      "suite_digest": "sha256:51cee03c162cecb5cc00fbf07a48028dc885c1fa9fa0abc941619213e349b5d4"
    }
  ],
  "input_artifacts": [
    {
      "path": "conformance/core/CT_CORE_0.1.json",
      "content_digest": "sha256:51272d58c2f284db18a8b8b2a4c7b3bc616ae597b0e6286e39a696d1a316816a"
    },
    {
      "path": "conformance/evidence/delegated_identity_producer_scenarios.json",
      "content_digest": "sha256:2e9a8ef25c2f4c59f7400785b2ef37311653a93878df1848df0eb1afaae523d5"
    },
    {
      "path": "conformance/evidence/mediated_blocking_producer_scenarios.json",
      "content_digest": "sha256:28d2e19bc0d9962be955ae60b69eecfc97e7123b50da8b2afc3a7395bc3868d0"
    },
    {
      "path": "conformance/evidence/product_profile_consumer_expectations.json",
      "content_digest": "sha256:b7cc0def043921a56dae942a257a7312da35dd6eba00a9730d5f57c0f5630171"
    },
    {
      "path": "conformance/evidence/product_profile_producer_scenario.schema.json",
      "content_digest": "sha256:44ce01841f4a07431c5638e84e59d1d4f3e7f3b70386bacc7f789b0e71418ace"
    },
    {
      "path": "conformance/evidence/resumable_sessions_producer_scenarios.json",
      "content_digest": "sha256:2ca5adeeb7f4f269276fd557a5711febc6f109437e77fadbe2afd3351c12b8d2"
    },
    {
      "path": "conformance/extensions/CN_CAPNEG_0.1.json",
      "content_digest": "sha256:ac1bfb0832eaa9473a37d31f0fd635a11307bea4cc444de6670e917d6d159d1a"
    },
    {
      "path": "conformance/extensions/DI_DELEGATED_IDENTITY_0.1.json",
      "content_digest": "sha256:7a28d12febf6036124f74923993ce2da58dddbb1417283f26038d723d61cce3f"
    },
    {
      "path": "conformance/extensions/ENF_ENFORCEMENT_0.1.json",
      "content_digest": "sha256:51cee03c162cecb5cc00fbf07a48028dc885c1fa9fa0abc941619213e349b5d4"
    },
    {
      "path": "conformance/extensions/ID_IDENTITY_LC_0.1.json",
      "content_digest": "sha256:1ae63ca6976a1cc8fe79da837ee2a3205d6c3328296c588488ec5aeccb626bec"
    },
    {
      "path": "conformance/extensions/OR_OBJECT_RESYNC_0.1.json",
      "content_digest": "sha256:24147384afa38bb66f0f56da12e2beaaa7f634230222fe1e6bf8427f20e60669"
    },
    {
      "path": "conformance/extensions/PE_POLICY_EVAL_0.1.json",
      "content_digest": "sha256:486a86b7cb0c3f8bc6b0fecc6c20dc853fd8e0a68bd334b6319839459739b0f6"
    },
    {
      "path": "conformance/extensions/RS_RESUME_0.1.json",
      "content_digest": "sha256:513eb3614ffea74def0a8e7dd9e8625849e61966e082ccf777658f450205ecaa"
    },
    {
      "path": "conformance/profiles/PF_AICP_MEDIATED_BLOCKING_0.1.json",
      "content_digest": "sha256:6cee6100ed6fb358d83cd1e04b5242da0aeb43239d50ecbf21db7b685fee3fca"
    },
    {
      "path": "conformance/vectors/unicode_codepoint_key_order.json",
      "content_digest": "sha256:369fd3088374e1894be308c22c42a90e4fe5652a38cc5ec6016860a4f77aefed"
    },
    {
      "path": "fixtures/extensions/capneg/CN-01_basic_negotiation.jsonl",
      "content_digest": "sha256:da612d4ccbc99b97344a5b85836ef7466c661275428cf1f03ca93a6a2c75259e"
    },
    {
      "path": "fixtures/extensions/capneg/CN-02_reject_incompatible_profile.jsonl",
      "content_digest": "sha256:1fb4d08f16a51338fc727efc6ea62bde74d2495c9d5bf3c4363b9d153778ec39"
    },
    {
      "path": "fixtures/extensions/capneg/CN-05_profile_agree_mediated_blocking_pass.jsonl",
      "content_digest": "sha256:0e858fa9f4da695760e92da55a0e28826d30a893ac51ab083ba4eb8eb29222aa"
    },
    {
      "path": "fixtures/extensions/capneg/CN-06_profile_downgrade_attempt_expected_fail.jsonl",
      "content_digest": "sha256:d702ba121282838448a6dbd0b26fb422b426eb888e6e680654600f326fab5e58"
    },
    {
      "path": "fixtures/extensions/capneg/CN-07_negotiation_bound_into_contract_pass.jsonl",
      "content_digest": "sha256:b980293a3f6d13b1ef1621fa160c81daf8d04ffc974cef84db2e1cb6484a238e"
    },
    {
      "path": "fixtures/extensions/capneg/CN-08_missing_or_mismatched_contract_binding_expected_fail.jsonl",
      "content_digest": "sha256:1541b934996b73a4047568ab22ba9a128ae983d02a5437805ae829a086c69fe9"
    },
    {
      "path": "fixtures/extensions/capneg/CN-09_channel_properties_negotiation_pass.jsonl",
      "content_digest": "sha256:250bc11684fa3b1c3cedef0930c464b82574397debd46ab86518ad90ab5c4f03"
    },
    {
      "path": "fixtures/extensions/capneg/CN-10_profile_rejection_reason_expected_fail.jsonl",
      "content_digest": "sha256:64698a10d7e0072a186c39b496eb583f120da606f85de366c5e84cab492c6e67"
    },
    {
      "path": "fixtures/extensions/capneg/CN-11_authenticated_base_crypto_pass.jsonl",
      "content_digest": "sha256:f44fe65e0ebcea59b053fd4bbde5ab451eb43a7b82ecbcc9d8fe1f36052ee6cf"
    },
    {
      "path": "fixtures/extensions/capneg/CN-12_authenticated_base_crypto_missing_expected_fail.jsonl",
      "content_digest": "sha256:07248a142b50ca9b1b712f9a3b15da541bc0855da5dfd7fefb659ed997a5d7f4"
    },
    {
      "path": "fixtures/extensions/capneg/CN-NEG-01_downgrade_attempt_expected_fail.jsonl",
      "content_digest": "sha256:6e81f3e1c6151784016ff415efe74bf0599ef0e28ecd8a366b5802c49493ec21"
    },
    {
      "path": "fixtures/extensions/delegated_identity/DI-01_issue_and_use_binding_pass.jsonl",
      "content_digest": "sha256:b90917a8c87d1f4279bb46b47fa75d60644aaa402296eeae4a92ef514c9c354a"
    },
    {
      "path": "fixtures/extensions/delegated_identity/DI-02_revoke_then_use_expected_fail.jsonl",
      "content_digest": "sha256:f5625a5237ab3b7680552e38dc1af142b6bcaccc8a16267019f5b6992b68d1f4"
    },
    {
      "path": "fixtures/extensions/enforcement/EF-01_allow_and_deliver.jsonl",
      "content_digest": "sha256:23735f224687a44494a10027a658a42e2149fe056533959ffb96a93a019828f3"
    },
    {
      "path": "fixtures/extensions/enforcement/EF-02_deny_but_delivered_expected_fail.jsonl",
      "content_digest": "sha256:1372f1adea3d4b8ddaf3fc12eed808ab1b9151812542867a0b74e5fa6da6e9bb"
    },
    {
      "path": "fixtures/extensions/identity_lc/IL-01_announce_and_verify_session_local_key.jsonl",
      "content_digest": "sha256:e6be4e2afe58d90128a9adb6791ba3103d70b3c751afd9540330babecc4f61f8"
    },
    {
      "path": "fixtures/extensions/identity_lc/IL-02_rotation_cross_sign_and_use_new_key.jsonl",
      "content_digest": "sha256:c2087a457e2932bc794f6e33249f786d889ad531747dd67ebaddf52b4f049923"
    },
    {
      "path": "fixtures/extensions/identity_lc/IL-03_revoke_then_use_revoked_key_expected_fail.jsonl",
      "content_digest": "sha256:918eef8ed333ca029f6af017b1a53765ec160179f87b4c40e8c72269128dc492"
    },
    {
      "path": "fixtures/extensions/object_resync/OR-01_object_request_response.jsonl",
      "content_digest": "sha256:1e26faebdf27ce00d555554afd913b65d8281dda4803e57d60ec8f73b4982dfd"
    },
    {
      "path": "fixtures/extensions/object_resync/OR-02_state_sync.jsonl",
      "content_digest": "sha256:05f5aff3095982a64cf22b6835a3ce5b2baf07a6f2199267b1296a72a1daadca"
    },
    {
      "path": "fixtures/extensions/policy_eval/PE-01_basic_allow.jsonl",
      "content_digest": "sha256:d89b1505c9e831a95a9594e4b3d14ab76b0905a643b6de8e95c55cdd89dba9d0"
    },
    {
      "path": "fixtures/extensions/policy_eval/PE-02_unknown_reason_code_expected_fail.jsonl",
      "content_digest": "sha256:b51a0daee7409dc4ee915e92e1672eacd88272ed68ea07196d33632135f5bc0a"
    },
    {
      "path": "fixtures/extensions/policy_eval/PE-05_policy_decision_attest_presence.jsonl",